id,nom_document,axe_principal,axes_secondaires,obligatoire,type_document,description_attendue,criteres_lies,questions_liees,frequence_maj,created_at
f267ec23-6706-46c8-abe4-882192e7f0e6,"Rapports d'analyse d'événements SSE (causes, actions)",4,[],true,rapport,"Recueil des faits et analyse (enquête) détaillant les circonstances, contrôlant les actions immédiates, identifiant les causes (immédiates, profondes, organisationnelles) et définissant des actions correctives/préventives.","[""4.1.6"",""4.1.7"",""4.1.8"",""4.1.9"",""4.1.10"",""4.1.11"",""4.1.12"",""4.1.13"",""4.1.14"",""4.1.15""]","[""[4.1.6] L'employeur réalise-t-il un recueil des faits pour chaque évènement ?"",""[4.1.10] Cette enquête permet-elle d'identifier : les causes immédiates ?"",""[4.1.11] Cette enquête permet-elle d'identifier : les causes profondes ?"",""[4.1.12] Cette enquête permet-elle d'identifier : les causes organisationnelles ?"",""[4.1.13] Cette enquête permet-elle de définir des actions correctives et préventives adaptées ?""]",selon_activite,2025-06-03 19:06:58.702984
0db29347-84b0-43b5-8a1b-7501beef1dc2,Programme et rapports d'audit du système de management SÉCURITÉ SANTÉ ENVIRONNEMENT,4,[],true,rapport,"Audit système annuel sur l'ensemble du périmètre, réalisé par auditeur compétent, avec rapport formalisé, communiqué, et actions suivies pour vérifier conformité, application et efficacité du système.","[""4.3.1"",""4.3.2"",""4.3.3"",""4.3.4"",""4.3.5"",""4.3.6"",""4.3.7"",""4.3.8"",""4.3.9"",""4.3.10"",""4.3.11"",""4.3.12"",""4.3.13"",""4.3.14"",""4.3.15"",""4.3.16""]","[""[4.3.1] L'employeur a-t-il défini un dispositif d'audit du système de management SÉCURITÉ SANTÉ ENVIRONNEMENT ?"",""[4.3.10] Les audits du système de management permettent-ils de vérifier : la conformité du système par rapport au référentiel appliqué ?"",""[4.3.11] Les audits du système de management permettent-ils de vérifier : l'application du système ?"",""[4.3.12] Les audits du système de management permettent-ils de vérifier : l'efficacité du système ?"",""[4.3.13] Les résultats des audits du système de management font-ils l'objet d'un enregistrement ?""]",annuelle,2025-06-03 19:06:58.702984
c6ca8e56-139c-457a-bc21-79d238d1d5b5,"Registre des situations dangereuses, presqu'accidents, accidents, maladies professionnelles et impacts environnementaux",4,[],true,registre,Dispositif de déclaration et d'enregistrement de tous les événements SSE.,"[""4.1.1"",""4.1.2"",""4.1.3"",""4.1.4"",""4.1.5""]","[""[4.1.1] L'employeur a-t-il défini un dispositif de déclaration et d'enregistrement des situations dangereuses, presqu'accidents et accidents ?""]",continue,2025-06-03 19:06:58.702984
39cceecd-ef46-4ab0-8842-45cc0b4bdc1d,Programme et rapports d'audits terrain SÉCURITÉ SANTÉ ENVIRONNEMENT,4,[],true,rapport,"Dispositif d'audits/visites terrain (bureaux, ateliers, chantiers) planifiés, réalisés par du personnel formé, avec rapports formalisés, communiqués et actions suivies.","[""4.2.1"",""4.2.2"",""4.2.3"",""4.2.4"",""4.2.5"",""4.2.6"",""4.2.7"",""4.2.8"",""4.2.9"",""4.2.10"",""4.2.11"",""4.2.12"",""4.2.13""]","[""[4.2.1] L'employeur a-t-il mis en place un dispositif d'audits/visites terrain SÉCURITÉ SANTÉ ENVIRONNEMENT ?"",""[4.2.10] Les audits/visites terrain permettent-ils de vérifier : l'application des modes opératoires ?"",""[4.2.11] Les audits/visites terrain permettent-ils de vérifier : l'application des moyens de prévention ?"",""[4.2.12] Les audits/visites terrain permettent-ils de vérifier : l'adéquation de la préparation avec la réalisation ?"",""[4.2.13] Les audits/visites terrain permettent-ils de vérifier : la pertinence et l'efficacité des analyses de risques et des modes opératoires ?""]",trimestrielle,2025-06-03 19:06:58.702984
4f7a3bc9-e88e-479b-88e1-ee1e63183a93,Bilan annuel SÉCURITÉ SANTÉ ENVIRONNEMENT,5,[],true,rapport,"Analyse factuelle annuelle (quantitative et qualitative) entre objectifs, moyens et résultats. Intègre atteinte des objectifs, pertinence des indicateurs, écarts réglementaires, événements SSE, résultats d'audits, efficacité du système. Communiqué au personnel.","[""5.1.1"",""5.1.2"",""5.1.3"",""5.1.4"",""5.1.5"",""5.1.6"",""5.1.7"",""5.1.8"",""5.1.9"",""5.1.10"",""5.1.11"",""5.1.12"",""5.1.13""]","[""[5.1.1] L'employeur établit-il un bilan annuel SÉCURITÉ SANTÉ ENVIRONNEMENT ?"",""[5.1.10] Ce bilan intègre-t-il : les impacts environnementaux ?"",""[5.1.11] Ce bilan intègre-t-il : les résultats des audits/visites terrain et des audits du système de management ?"",""[5.1.12] Ce bilan intègre-t-il : l'efficacité du système de management SÉCURITÉ SANTÉ ENVIRONNEMENT ?"",""[5.1.13] Ce bilan fait-il l'objet d'une communication adaptée au personnel de l'entreprise ?""]",annuelle,2025-06-03 19:06:58.702984
5ad5fb53-0e5f-409e-976f-4fe0fb0b61be,Plan d'amélioration SÉCURITÉ SANTÉ ENVIRONNEMENT (issu du bilan),5,[],true,plan,"Actions d'amélioration définies suite au bilan SSE, pouvant faire évoluer objectifs, indicateurs, politique, plans d'actions, documentation, moyens, dispositifs d'information/animation. Intègre évolutions de l'entreprise et réglementaires. Suivi de la mise en œuvre.","[""5.2.1"",""5.2.2"",""5.2.3"",""5.2.4"",""5.2.5"",""5.2.6"",""5.2.7"",""5.2.8"",""5.2.9"",""5.2.10"",""5.2.11"",""5.2.12"",""5.2.13""]","[""[5.2.1] L'employeur définit-il des actions d'amélioration SÉCURITÉ SANTÉ ENVIRONNEMENT adaptées aux constats du bilan ?"",""[5.2.10] Ces actions d'amélioration s'appuient-elles sur : une révision de la documentation et des moyens SÉCURITÉ SANTÉ ENVIRONNEMENT ?"",""[5.2.11] Ces actions d'amélioration s'appuient-elles sur : une révision des dispositifs d'information et d'animation SÉCURITÉ SANTÉ ENVIRONNEMENT ?"",""[5.2.12] Ces actions d'amélioration intègrent-elles les évolutions de l'entreprise, de ses activités, de son contexte réglementaire et normatif ?"",""[5.2.13] L'employeur suit-il la mise en œuvre de ces actions d'amélioration ?""]",annuelle,2025-06-03 19:06:58.73662